{"baseSha":"aaaaaaaaaaaaaaaaaaaaaaaaaaaaaaaaaaaaaaaa","concurrency":2,"dispatchStrategy":"rolling","effortPolicyVersion":"speed.v1","executionMode":"parallel","gatePolicyDigest":"sha256:4444444444444444444444444444444444444444444444444444444444444444","hostEvidenceDigest":"sha256:c3d16f30ece5a5fa4a9f7f6c3c703102e9aac21e0f97cae0094436c6db0c750b","initialReadyStoryIds":["alpha"],"integrationBranch":"cb/rolling/integration","integrationExpectedSha":"aaaaaaaaaaaaaaaaaaaaaaaaaaaaaaaaaaaaaaaa","normalizedInputDigest":"sha256:354c80c467d79e8357bb479c259fd07f9224a54e221c138ae447876372ac243e","reasons":["Rolling is explicitly authorized for the v2 contract fixture."],"runId":"cb-rolling-1111111111111111","schedulingPolicyDigest":"sha256:3333333333333333333333333333333333333333333333333333333333333333","schemaVersion":"compass-builder.pipeline-plan.v2","stories":[{"branch":"cb/cb-rolling-1111111111111111/alpha","dependsOn":[],"handoffDigest":"sha256:5555555555555555555555555555555555555555555555555555555555555555","integrationOrdinal":1,"recommendedEffort":"high","requiredOutcomeGateIds":["gate-alpha"],"specificationOrder":0,"storyId":"alpha","writeScopes":["src/alpha"]},{"branch":"cb/cb-rolling-1111111111111111/beta","dependsOn":["alpha"],"handoffDigest":"sha256:6666666666666666666666666666666666666666666666666666666666666666","integrationOrdinal":2,"recommendedEffort":"medium","requiredOutcomeGateIds":["gate-beta"],"specificationOrder":1,"storyId":"beta","writeScopes":["src/beta"]}]}
